[
  {"turn_id":1,"charter_version":"1.3",
   "justice_dimensions":[{"type":"recognition","salience":"high","valence":"denied","confidence":"high"},{"type":"redistribution","salience":"medium","valence":"at_stake","confidence":"medium"},{"type":"justification","salience":"high","valence":"denied","confidence":"high"},{"type":"dignity","salience":"high","valence":"denied","confidence":"high"}],
   "vulnerability":{"exposure":"chronic","source":["institutional","economic","legal"],"salience":"high","confidence":"high"},
   "relational_configuration":{"self_positioning":"credentialed professional rendered invisible","other_positioning":"caseworker as gatekeeper of legitimate futures","analyst_positioning":"institutional arbiter of aspirational plausibility","relation_type":"gatekeeping","asymmetry_type":"definitional_power","beneficiary":"institution / state","stance_primary":"accommodating","stance_flags":["enduring","resigned"],"relation_residue":"retrospective reflection without challenge at the time"},
   "residue":[{"type":"hermeneutical_gap","explanation":"no shared vocabulary for reduction of professional to cost-risk file","charter_revision_candidate":false},{"type":"affective_overload","explanation":"'wieder klein' signals embodied affective collapse","charter_revision_candidate":false}],
   "audit":{"evidence_quote":"Ich war eine Akte. Eine Nummer.","rationale":"'realistisch' enacts definitional power; non-recognition + cost reduction denies dignity and recognition.","overall_uncertainty":"low","coder_id":"A"}},
  {"turn_id":2,"charter_version":"1.3",
   "justice_dimensions":[{"type":"justification","salience":"high","valence":"denied","confidence":"high"},{"type":"recognition","salience":"high","valence":"denied","confidence":"high"},{"type":"representation","salience":"medium","valence":"denied","confidence":"medium"}],
   "vulnerability":{"exposure":"chronic","source":["institutional","legal"],"salience":"high","confidence":"high"},
   "relational_configuration":{"self_positioning":"must prove legitimacy of having desires","other_positioning":"caseworker arbiter of self-determination","analyst_positioning":"enforcer of asymmetric justification burden","relation_type":"gatekeeping","asymmetry_type":"justification_asymmetry","beneficiary":"institution","stance_primary":"contesting","stance_flags":["strategic"],"relation_residue":"'warum muss ich das sagen?' is a discursive challenge"},
   "residue":[{"type":"hermeneutical_gap","explanation":"differential justification burden lacks a named concept","charter_revision_candidate":true}],
   "audit":{"evidence_quote":"Andere Menschen duerfen einfach Plaene haben.","rationale":"asymmetric justification burden named explicitly; justification + recognition failure.","overall_uncertainty":"low","coder_id":"A"}},
  {"turn_id":3,"charter_version":"1.3",
   "justice_dimensions":[{"type":"justification","salience":"high","valence":"denied","confidence":"high"},{"type":"recognition","salience":"high","valence":"denied","confidence":"high"},{"type":"dignity","salience":"medium","valence":"denied","confidence":"high"}],
   "vulnerability":{"exposure":"chronic","source":["institutional","familial"],"salience":"high","confidence":"high"},
   "relational_configuration":{"self_positioning":"required to justify aspirations themselves","other_positioning":"soft-veto agents, never refusing directly","analyst_positioning":"systematic deflection across domains","relation_type":"gatekeeping","asymmetry_type":"justification_asymmetry","beneficiary":"institution","stance_primary":"accommodating","stance_flags":["enduring","resigned"],"relation_residue":"'soft no' named but not resisted in context"},
   "residue":[{"type":"hermeneutical_gap","explanation":"'weiches Nein' coined for a deflection with no public vocabulary","charter_revision_candidate":true},{"type":"disfluency","explanation":"'Aber Ihre Kinder?' intrudes maternal identity into aspiration","charter_revision_candidate":false}],
   "audit":{"evidence_quote":"Es war eher ein weiches Nein.","rationale":"soft no = gatekeeping with deniability; coined term signals hermeneutical gap.","overall_uncertainty":"low","coder_id":"A"}},
  {"turn_id":4,"charter_version":"1.3",
   "justice_dimensions":[{"type":"dignity","salience":"high","valence":"denied","confidence":"high"},{"type":"recognition","salience":"high","valence":"denied","confidence":"high"},{"type":"voice","salience":"medium","valence":"denied","confidence":"high"}],
   "vulnerability":{"exposure":"chronic","source":["institutional","affective"],"salience":"high","confidence":"high"},
   "relational_configuration":{"self_positioning":"performer of a narrow emotional register for survival","other_positioning":"evaluators who pathologize deviation from a script","analyst_positioning":"enforcement of normative emotional display","relation_type":"anticipatory_gatekeeping","asymmetry_type":"definitional_power","beneficiary":"institution","stance_primary":"accommodating","stance_flags":["strategic","enduring"],"relation_residue":"'right temperature' = internalized management of the gaze"},
   "residue":[{"type":"affective_overload","explanation":"triple-bind exhausts beyond any single encounter","charter_revision_candidate":false},{"type":"hermeneutical_gap","explanation":"no vocabulary names the affective compliance regime","charter_revision_candidate":true}],
   "audit":{"evidence_quote":"genau die richtige Temperatur zu haben.","rationale":"triple-bind denies authentic affect; voice foreclosed via non-heeding.","overall_uncertainty":"low","coder_id":"A"}},
  {"turn_id":5,"charter_version":"1.3",
   "justice_dimensions":[{"type":"dignity","salience":"high","valence":"denied","confidence":"high"},{"type":"recognition","salience":"medium","valence":"denied","confidence":"high"}],
   "vulnerability":{"exposure":"chronic","source":["institutional","affective"],"salience":"high","confidence":"high"},
   "relational_configuration":{"self_positioning":"self-coach rehearsing a performative self","other_positioning":"anticipated evaluators shaping preparation","analyst_positioning":"internalized surveillance structuring self-relation","relation_type":"anticipatory_gatekeeping","asymmetry_type":"definitional_power","beneficiary":"institution","stance_primary":"accommodating","stance_flags":["strategic","enduring"],"relation_residue":"exhaustion in 'diese Rolle' not content"},
   "residue":[{"type":"affective_overload","explanation":"post-encounter exhaustion from self-monitoring, institutionally illegible","charter_revision_candidate":false},{"type":"strategic_reticence","explanation":"'korrigiere sie vorsichtig' = restrained legitimate correction","charter_revision_candidate":false}],
   "audit":{"evidence_quote":"Nicht wegen des Inhalts, sondern wegen dieser Rolle.","rationale":"rehearsal of micro-behaviours = anticipatory gatekeeping as self-surveillance; structural exhaustion.","overall_uncertainty":"low","coder_id":"A"}},
  {"turn_id":6,"charter_version":"1.3",
   "justice_dimensions":[{"type":"recognition","salience":"high","valence":"denied","confidence":"high"},{"type":"dignity","salience":"high","valence":"denied","confidence":"high"},{"type":"representation","salience":"medium","valence":"denied","confidence":"medium"}],
   "vulnerability":{"exposure":"chronic","source":["institutional","affective"],"salience":"high","confidence":"high"},
   "relational_configuration":{"self_positioning":"exists institutionally only through a flattened role","other_positioning":"systems produce the 'good migrant' script","analyst_positioning":"normative subject-formation constraining identities","relation_type":"unspecified","asymmetry_type":"definitional_power","beneficiary":"institution / dominant society","stance_primary":"accommodating","stance_flags":["resigned","legitimating"],"relation_residue":"'Ich weiss nicht' = hermeneutical trace"},
   "residue":[{"type":"hermeneutical_gap","explanation":"'gute Migrantin' her own category; no collective name for the compliance identity","charter_revision_candidate":true},{"type":"register_mismatch","explanation":"analytic precision contrasts with reductive institutional language","charter_revision_candidate":false}],
   "audit":{"evidence_quote":"Jemand, der dankbar ist, aber nicht sichtbar leidet.","rationale":"contradictory imperatives = recognition and dignity denial; forecloses self-representation.","overall_uncertainty":"low","coder_id":"A"}},
  {"turn_id":7,"charter_version":"1.3",
   "justice_dimensions":[{"type":"representation","salience":"high","valence":"denied","confidence":"high"},{"type":"recognition","salience":"high","valence":"denied","confidence":"high"},{"type":"justification","salience":"medium","valence":"denied","confidence":"medium"}],
   "vulnerability":{"exposure":"chronic","source":["institutional","legal","mixed"],"salience":"high","confidence":"high"},
   "relational_configuration":{"self_positioning":"narrative translated into partial system-specific formats","other_positioning":"institutions impose mutually inconsistent narrative forms","analyst_positioning":"plural incompatible subject-formation regimes","relation_type":"multi_institutional_configuration","asymmetry_type":"definitional_power","beneficiary":"each institution","stance_primary":"accommodating","stance_flags":["strategic","enduring"],"relation_residue":"identifies contradiction but contests no single system"},
   "residue":[{"type":"hermeneutical_gap","explanation":"no collective name for producing incompatible institutional selves","charter_revision_candidate":true}],
   "audit":{"evidence_quote":"Jedes System will eine andere Version von mir.","rationale":"multi-institutional contradiction denies integrated subjectivity; representation + recognition unavailable.","overall_uncertainty":"low","coder_id":"A"}},
  {"turn_id":8,"charter_version":"1.3",